Title,Artist,Year,Month,Day,Lyrics,BPM,Key,Valence,Charts
Superman,"Eminem, Dina Rae",2002,5,26,eminem  dina rae mhmmm inhales you high baby yeah yeah talk to me you want me to tell you something uhhuh i know what you wanna hear  refrain eminem  dina rae 'cause i know you want me baby i think i want you too i think i love you baby i think i love you too i'm here to save you girl come be in shady's world i wanna grow together let's let our love unfurl you know you want me baby you know i want you too they call me superman i'm here to rescue you i wanna save you girl come be in shady's world oh boy you drive me crazy bitch you make me hurl   eminem they call me superman leap tall hoes in a single bound i'm single now got no ring on this finger now i'd never let another chick bring me down in a relationship save it bitch babysit you make me sick superman ain't savin' shit girl you can jump on shady's dick straight from the hip cut to the chase i tell a motherfuckin' slut to her face play no games say no names ever since i broke up with what'sherface i'm a different man kiss my ass kiss my lips bitch why ask kiss my dick get my cash i'd rather have you whip my ass don't put out i'll put you out won't get out i'll push you out puss blew out poppin' shit wouldn't piss on fire to put you out am i too nice buy you ice bitch if you died wouldn't buy you life what you tryin' to be my new wife what you mariah fly through twice  pre eminem but i do know one thing though bitches they come they go saturday through sunday monday monday through sunday yo maybe i'll love you one day maybe we'll someday grow 'til then just sit your drunk ass on that fuckin' runway ho   eminem cause i can't be your superman can't be your superman can't be your superman can't be your superman i can't be your superman can't be your superman can't be your superman your superman your superman   eminem don't get me wrong i love these hoes it's no secret everybody knows yeah we fuckedbitch so what that's about as far as your buddy goes we'll be friends i'll call you again i'll chase you around every bar you attend never know what kinda car i'll be in we'll see how much you'll be partyin' then you don't want that neither do i i don't wanna flip when i see you with guys too much pride between you and i not a jealous man but females lie but i guess that's just what sluts do how could it ever be just us two i'd never love you enough to trust you we just met and i just fucked you  pre eminem but i do know one thing though bitches they come they go saturday through sunday monday monday through sunday yo maybe i'll love you one day maybe we'll someday grow 'til then just sit your drunk ass on that fuckin' runway ho   eminem cause i can't be your superman can't be your superman can't be your superman can't be your superman i can't be your superman can't be your superman can't be your superman your superman your superman cause i can't be your superman can't be your superman can't be your superman can't be your superman i can't be your superman can't be your superman can't be your superman your superman your superman  refrain eminem  dina rae 'cause i know you want me baby i think i want you too i think i love you baby i think i love you too i'm here to save you girl come be in shady's world i wanna grow together let's let our love unfurl you know you want me baby you know i want you too they call me superman i'm here to rescue you i wanna save you girl come be in shady's world oh boy you drive me crazy bitch you make me hurl   eminem first thing you say i'm not fazed i hang around big stars all day i don't see what the big deal is anyway you're just plain old marshall to me ooh yeah girl run that game hailie jade i love that name love that tattoo what's that say rot in pieces uh that's great first off you don't know marshall at all so don't grow partial that's ammo for my arsenal i'll slap you off that bar stool there goes another lawsuit leave handprints all across you good lordy whoadie you must be gone off that water bottle you want what you can't have ooh girl that's too damn bad don't touch what you can't grab end up with two backhands put anthrax on a tampax and slap you 'til you can't stand girl you just blew your chance don't mean to ruin your plans  pre eminem but i do know one thing though bitches they come they go saturday through sunday monday monday through sunday yo maybe i'll love you one day maybe we'll someday grow 'til then just sit your drunk ass on that fuckin' runway ho   eminem cause i can't be your superman can't be your superman can't be your superman can't be your superman i can't be your superman can't be your superman can't be your superman your superman your superman cause i can't be your superman can't be your superman can't be your superman can't be your superman i can't be your superman can't be your superman can't be your superman your superman your superman  refrain eminem  dina rae 'cause i know you want me baby i think i want you too i think i love you baby i think i love you too i'm here to save you girl come be in shady's world i wanna grow together let's let our love unfurl you know you want me baby you know i want you too they call me superman i'm here to rescue you i wanna save you girl come be in shady's world oh boy you drive me crazy bitch you make me hurl   eminem cause i can't be your superman can't be your superman can't be your superman can't be your superman i can't be your superman can't be your superman can't be your superman your superman your superman cause i can't be your superman can't be your superman can't be your superman can't be your superman i can't be your superman can't be your superman can't be your superman your superman your superman,130,E,64,14
The Real Slim Shady,Eminem,2000,4,23,may i have your attention please may i have your attention please will the real slim shady please stand up i repeat will the real slim shady please stand up we're gonna have a problem here   y'all act like you never seen a white person before jaws all on the floor like pam like tommy just burst in the door and started whoopin' her ass worse than before they first were divorced suin' her over furniture agh it's the return of the oh wait no way you're kidding he didn't just say what i think he did did he and dr dre said nothing you idiots dr dre's dead he's locked in my basement ha ha feminist women love eminem chicka chicka chicka slim shady i'm sick of him look at him walkin' around grabbin' his youknowwhat flippin' the youknowwho yeah but he's so cute though yeah i probably got a couple of screws up in my head loose but no worse than what's goin' on in your parents' bedrooms sometimes i wanna get on tv and just let loose but can't but it's cool for tom green to hump a dead moose my bum is on your lips my bum is on your lips and if i'm lucky you might just give it a little kiss and that's the message that we deliver to little kids and expect them not to know what a woman's clitoris is of course they're gonna know what intercourse is by the time they hit fourth grade they've got the discovery channel don't they we ain't nothin' but mammalswell some of us cannibals who cut other people open like cantaloupes but if we can hump dead animals and antelopes then there's no reason that a man and another man can't elope but if you feel like i feel i got the antidote women wave your pantyhose sing the  and it goes   i'm slim shady yes i'm the real shady all you other slim shadys are just imitating so won't the real slim shady please stand up please stand up please stand up 'cause i'm slim shady yes i'm the real shady all you other slim shadys are just imitating so won't the real slim shady please stand up please stand up please stand up   will smith don't gotta cuss in his raps to sell records nope well i do so fuck him and fuck you too you think i give a damn about a grammy half of you critics can't even stomach me let alone stand me but slim what if you win wouldn't it be weird why so you guys could just lie to get me here so you can sit me here next to britney spears shit christina aguilera better switch me chairs so i can sit next to carson daly and fred durst and hear 'em argue over who she gave head to first little bitch put me on blast on mtv yeah he's cute but i think he's married to kim heehee i should download her audio on mp and show the whole world how you gave eminem vd agh i'm sick of you little girl and boy groups all you do is annoy me so i have been sent here to destroy you and there's a million of us just like me who cuss like me who just don't give a fuck like me who dress like me walk talk and act like me and just might be the next best thing but not quite me   'cause i'm slim shady yes i'm the real shady all you other slim shadys are just imitating so won't the real slim shady please stand up please stand up please stand up 'cause i'm slim shady yes i'm the real shady all you other slim shadys are just imitating so won't the real slim shady please stand up please stand up please stand up   i'm like a head trip to listen to cause i'm only givin' you things you joke about with your friends inside your livin' room the only difference is i got the balls to say it in front of y'all and i don't gotta be false or sugarcoat it at all i just get on the mic and spit it and whether you like to admit it i just shit it better than ninety percent of you rappers out can then you wonder how can kids eat up these albums like valiums it's funny cause at the rate i'm going when i'm thirty i'll be the only person in the nursing home flirting pinching nurse's asses when i'm jacking off with jergens and i'm jerking but this whole bag of viagra isn't working and every single person is a slim shady lurking he could be working at burger king spittin' on your onion rings or in the parking lot circling screaming i don't give a fuck with his windows down and his system up so will the real shady please stand up and put one of those fingers on each hand up and be proud to be outta your mind and outta control and one more time loud as you can how does it go   i'm slim shady yes i'm the real shady all you other slim shadys are just imitating so won't the real slim shady please stand up please stand up please stand up 'cause i'm slim shady yes i'm the real shady all you other slim shadys are just imitating so won't the real slim shady please stand up please stand up please stand up 'cause i'm slim shady yes i'm the real shady all you other slim shadys are just imitating so won't the real slim shady please stand up please stand up please stand up 'cause i'm slim shady yes i'm the real shady all you other slim shadys are just imitating so won't the real slim shady please stand up please stand up please stand up   ha ha i guess theres a slim shady in all of us fuck it lets all stand up  produced by dr dre  melman,104,F,78,27
The Scientist,Coldplay,2002,8,26,come up to meet you tell you i'm sorry you don't know how lovely you are i had to find you tell you i need you tell you i set you apart tell me your secrets and ask me your questions oh let's go back to the start running in circles coming up tails heads on a science apart   nobody said it was easy it's such a shame for us to part nobody said it was easy no one ever said it would be this hard oh take me back to the start   i was just guessing at numbers and figures pulling the puzzles apart questions of science science and progress do not speak as loud as my heart tell me you love me come back and haunt me oh and i rush to the start running in circles chasing our tails coming back as we are   nobody said it was easy oh it's such a shame for us to part nobody said it was easy no one ever said it would be so hard i'm going back to the start   ohooh oohoohoohooh ahooh oohoohoohooh ohooh oohoohoohooh ohooh oohoohoohooh,146,F,21,6
Thinking Out Loud,Ed Sheeran,2014,6,23,when your legs don't work like they used to before and i can't sweep you off of your feet will your mouth still remember the taste of my love will your eyes still smile from your cheeks and darling i will be loving you till we're seventy and baby my heart could still fall as hard at twentythree and i'm thinking 'bout how  pre  people fall in love in mysterious ways maybe just the touch of a hand well me i fall in love with you every single day i just wanna tell you i am   so honey now take me into your loving arms kiss me under the light of a thousand stars place your head on my beating heart i'm thinking out loud and maybe we found love right where we are   when my hair's all but gone and my memory fades and the crowds don't remember my name when my hands don't play the strings the same way i know you will still love me the same 'cause honey your soul could never grow old it's evergreen and baby your smile's forever in my mind and memory and i'm thinking 'bout how  pre  people fall in love in mysterious ways and maybe it's all part of a plan well i'll just keep on making the same mistakes hoping that you'll understand   that baby now take me into your loving arms kiss me under the light of a thousand stars place your head on my beating heart i'm thinking out loud and maybe we found love right where we are   so baby now take me into your loving arms kiss me under the light of a thousand stars oh darling place your head on my beating heart i'm thinking out loud that maybe we found love right where we are oh baby we found love right where we are and we found love right where we are,79,D,58,0
We Found Love,"Rihanna, Calvin Harris",2011,9,22,video  agyness deyn it's like you're screaming and no one can hear you almost feel ashamed that someone could be that important that without them you feel like nothing no one will ever understand how much it hurts you feel hopeless like nothing can save you and when it's over and it's gone you almost wish you could have all that bad stuff back so that you could have the good   rihanna yellow diamonds in the light and we're standing side by side as your shadow crosses mine what it takes to come alive  pre rihanna it's the way i'm feeling i just can't deny but i've gotta let it go   rihanna we found love in a hopeless place we found love in a hopeless place we found love in a hopeless place we found love in a hopeless place   rihanna shine a light through an open door love and life i will divide turn away cause i need you more feel the heartbeat in my mind  pre rihanna it's the way i'm feeling i just can't deny but i've gotta let it go   rihanna we found love in a hopeless place we found love in a hopeless place we found love in a hopeless place we found love in a hopeless place   rihanna yellow diamonds in the light and we're standing side by side as your shadow crosses mine   rihanna we found love in a hopeless place we found love in a hopeless place we found love in a hopeless place we found love in a hopeless place   rihanna we found love in a hopeless place we found love in a hopeless place we found love in a hopeless place we found love in a hopeless place,128,C#,60,21
Without Me,Eminem,2002,5,21,obie trice obie trice real name no gimmicks record scratch  refrain  eminem two trailer park girls go 'round the outside 'round the outside 'round the outside two trailer park girls go 'round the outside 'round the outside 'round the outside  refrain  eminem guess who's back back again shady's back tell a friend guess who's back guess who's back guess who's back guess who's back guess who's back guess who's back guess who's back   eminem i've created a monster 'cause nobody wants to see marshall no more they want shady i'm chopped liver well if you want shady this is what i'll give ya a little bit of weed mixed with some hard liquor some vodka that'll jump start my heart quicker than a shock when i get shocked at the hospital by the doctor when i'm not cooperating when i'm rocking the table while he's operating hey you waited this long now stop debating cause i'm back i'm on the rag and ovulating i know that you got a job ms cheney but your husband's heart problem's complicating so the fcc won't let me be or let me be me so let me see they try to shut me down on mtv but it feels so empty without me so come on and dip bum on your lips fuck that cum on your lips and some on your tits and get ready cause this shit's about to get heavy i just settled all my lawsuitsfuck you debbie   eminem now this looks like a job for me so everybody just follow me cause we need a little controversy cause it feels so empty without me i said this looks like a job for me so everybody just follow me cause we need a little controversy cause it feels so empty without me   eminem little hellions kids feeling rebellious embarrassed their parents still listen to elvis they start feeling like prisoners helpless 'til someone comes along on a mission and yells bitch a visionary vision is scary could start a revolution polluting the airwaves a rebel so just let me revel and bask in the fact that i got everyone kissing my ass smack and it's a disaster such a catastrophe for you to see so damn much of my assyou asked for me well i'm back nananananananananana fix your bent antenna tune it in and then i'm gonna enter in and up under your skin like a splinter the center of attention back for the winter i'm interesting the best thing since wrestling infesting in your kid's ears and nesting testing attention please feel the tension soon as someone mentions me here's my ten cents my two cents is free a nuisance who sent you sent for me   eminem now this looks like a job for me so everybody just follow me cause we need a little controversy cause it feels so empty without me i said this looks like a job for me so everybody just follow me cause we need a little controversy cause it feels so empty without me   eminem a tiskit a taskit i'll go tit for tat with anybody who's talking this shit that shit chris kirkpatrick you can get your ass kicked worse than them little limp bizkit bastards and moby you can get stomped by obie you 6yearold baldheaded fag blow me you don't know me you're too old let go it's over nobody listens to techno now let's go just give me the signal i'll be there with a whole list full of new insults i've been dope suspenseful with a pencil ever since prince turned himself into a symbol but sometimes the shit just seems everybody only wants to discuss me so this must mean i'm disgusting but it's just me i'm just obscene though i'm not the first king of controversy i am the worst thing since elvis presley to do black music so selfishly and use it to get myself wealthy hey there's a concept that works twenty million other white rappers emerge but no matter how many fish in the sea it'd be so empty without me   eminem now this looks like a job for me so everybody just follow me cause we need a little controversy cause it feels so empty without me i said this looks like a job for me so everybody just follow me cause we need a little controversy cause it feels so empty without me   eminem hum dei dei la la la la la la la la la la la la la la la la hum dei dei la la la la la la la la la la la la la la la la kids,112,G,67,43
